<report xmlns:xsi="http://www.w3.org/2001/XMLSchema-instance" year="2015" xsi:noNamespaceSchemaLocation="xsd/yearReport.xsd">
  <summary>
    <income/>
    <expense>-100</expense>
    <total>-100</total>
  </summary>
  <categories>
    <category name="Nezařazené" income="0" expense="-100" total="-100"/>
  </categories>
  <subjects>
    <subject name="Nezařazené" income="0" expense="-100" total="-100"/>
  </subjects>
</report>